{
  "$schema": "https://raw.githubusercontent.com/mannism/dlabs-toolkit/main/pricing/table.schema.json",
  "versionedAt": "2026-10-05",
  "anthropic": {
    "claude-opus-4-5": {
      "inputPer1M": 5.0,
      "outputPer1M": 25.0,
      "cacheReadPer1M": 0.5,
      "cacheWritePer1M": 6.25,
      "cacheWrite1hPer1M": 10.0,
      "verifiedAt": "2026-10-05",
      "sourceUrl": "https://platform.claude.com/docs/en/about-claude/pricing",
      "notes": "Active; Anthropic retirement not before 2026-11-24. Live API ID is claude-opus-4-5-20251101."
    },
    "claude-opus-4-7": {
      "inputPer1M": 5.0,
      "outputPer1M": 25.0,
      "cacheReadPer1M": 0.5,
      "cacheWritePer1M": 6.25,
      "cacheWrite1hPer1M": 10.0,
      "verifiedAt": "2026-10-05",
      "sourceUrl": "https://platform.claude.com/docs/en/about-claude/pricing"
    },
    "claude-sonnet-4-5": {
      "inputPer1M": 3.0,
      "outputPer1M": 15.0,
      "cacheReadPer1M": 0.3,
      "cacheWritePer1M": 3.75,
      "cacheWrite1hPer1M": 6.0,
      "verifiedAt": "2026-10-05",
      "sourceUrl": "https://platform.claude.com/docs/en/about-claude/pricing",
      "notes": "Deprecated by Anthropic 2026-09-30, retires 2026-11-30 (replacement claude-sonnet-5-5). Price unchanged; do not delete this key."
    },
    "claude-sonnet-4-6": {
      "inputPer1M": 3.0,
      "outputPer1M": 15.0,
      "cacheReadPer1M": 0.3,
      "cacheWritePer1M": 3.75,
      "cacheWrite1hPer1M": 6.0,
      "verifiedAt": "2026-10-05",
      "sourceUrl": "https://platform.claude.com/docs/en/about-claude/pricing"
    },
    "claude-haiku-4-5": {
      "inputPer1M": 1.0,
      "outputPer1M": 5.0,
      "cacheReadPer1M": 0.1,
      "cacheWritePer1M": 1.25,
      "cacheWrite1hPer1M": 2.0,
      "verifiedAt": "2026-10-05",
      "sourceUrl": "https://platform.claude.com/docs/en/about-claude/pricing",
      "notes": "Active; Anthropic retirement not sooner than 2026-10-15 (a floor, not a notice). Re-check monthly."
    },
    "claude-haiku-4-5-20251001": {
      "inputPer1M": 1.0,
      "outputPer1M": 5.0,
      "cacheReadPer1M": 0.1,
      "cacheWritePer1M": 1.25,
      "cacheWrite1hPer1M": 2.0,
      "verifiedAt": "2026-10-05",
      "sourceUrl": "https://platform.claude.com/docs/en/about-claude/pricing",
      "notes": "Active; Anthropic retirement not sooner than 2026-10-15 (a floor, not a notice). Re-check monthly."
    },
    "claude-opus-4-6": {
      "inputPer1M": 5.0,
      "outputPer1M": 25.0,
      "cacheReadPer1M": 0.5,
      "cacheWritePer1M": 6.25,
      "cacheWrite1hPer1M": 10.0,
      "verifiedAt": "2026-10-05",
      "sourceUrl": "https://platform.claude.com/docs/en/about-claude/pricing"
    },
    "claude-sonnet-4-5-20250929": {
      "inputPer1M": 3.0,
      "outputPer1M": 15.0,
      "cacheReadPer1M": 0.3,
      "cacheWritePer1M": 3.75,
      "cacheWrite1hPer1M": 6.0,
      "verifiedAt": "2026-10-05",
      "sourceUrl": "https://platform.claude.com/docs/en/about-claude/pricing",
      "notes": "Deprecated by Anthropic 2026-09-30, retires 2026-11-30 (replacement claude-sonnet-5-5). Price unchanged; do not delete this key."
    },
    "claude-haiku-3-5": {
      "inputPer1M": 0.8,
      "outputPer1M": 4.0,
      "cacheReadPer1M": 0.08,
      "cacheWritePer1M": 1.0,
      "cacheWrite1hPer1M": 1.6,
      "verifiedAt": "2026-10-05",
      "sourceUrl": "https://platform.claude.com/docs/en/about-claude/pricing",
      "notes": "Retired from Anthropic's first-party API 2026-02-19; still available via Bedrock/Google Cloud at this rate."
    },
    "claude-haiku-3": {
      "inputPer1M": 0.25,
      "outputPer1M": 1.25,
      "cacheReadPer1M": 0.03,
      "cacheWritePer1M": 0.3125,
      "cacheWrite1hPer1M": 0.5,
      "verifiedAt": "2026-08-18",
      "sourceUrl": "https://platform.claude.com/docs/en/about-claude/pricing",
      "notes": "Retired 2026-04-20 — no longer served on the first-party API. Price retained for historical cost calculations only."
    },
    "claude-opus-4-8": {
      "inputPer1M": 5.0,
      "outputPer1M": 25.0,
      "cacheReadPer1M": 0.5,
      "cacheWritePer1M": 6.25,
      "cacheWrite1hPer1M": 10.0,
      "verifiedAt": "2026-10-05",
      "sourceUrl": "https://platform.claude.com/docs/en/about-claude/pricing"
    },
    "claude-fable-5": {
      "inputPer1M": 10.0,
      "outputPer1M": 50.0,
      "cacheReadPer1M": 1.0,
      "cacheWritePer1M": 12.5,
      "cacheWrite1hPer1M": 20.0,
      "verifiedAt": "2026-10-05",
      "sourceUrl": "https://platform.claude.com/docs/en/about-claude/pricing"
    },
    "claude-fable-5-1": {
      "inputPer1M": 10.0,
      "outputPer1M": 50.0,
      "cacheReadPer1M": 0.25,
      "cacheWritePer1M": 12.5,
      "cacheWrite1hPer1M": 20.0,
      "verifiedAt": "2026-10-05",
      "sourceUrl": "https://platform.claude.com/docs/en/about-claude/pricing",
      "notes": "Cache reads priced at 0.025x base input (not the standard 0.1x multiplier every other Claude model uses) — this is Anthropic's documented rate, not an error. Do not 'correct' cacheReadPer1M toward inputPer1M * 0.1."
    },
    "claude-opus-5": {
      "inputPer1M": 5.0,
      "outputPer1M": 25.0,
      "cacheReadPer1M": 0.5,
      "cacheWritePer1M": 6.25,
      "cacheWrite1hPer1M": 10.0,
      "verifiedAt": "2026-10-05",
      "sourceUrl": "https://platform.claude.com/docs/en/about-claude/pricing"
    },
    "claude-sonnet-5": {
      "inputPer1M": 2.0,
      "outputPer1M": 10.0,
      "cacheReadPer1M": 0.2,
      "cacheWritePer1M": 2.5,
      "cacheWrite1hPer1M": 4.0,
      "verifiedAt": "2026-10-05",
      "sourceUrl": "https://platform.claude.com/docs/en/about-claude/pricing",
      "notes": "Permanent rate — Anthropic cancelled the planned 2026-08-31 increase to $3/$15 and made the $2/$10 rate standard. Do not 'correct' this back to $3/$15."
    },
    "claude-mythos-5": {
      "inputPer1M": 10.0,
      "outputPer1M": 50.0,
      "cacheReadPer1M": 1.0,
      "cacheWritePer1M": 12.5,
      "cacheWrite1hPer1M": 20.0,
      "verifiedAt": "2026-10-05",
      "sourceUrl": "https://platform.claude.com/docs/en/about-claude/pricing",
      "notes": "Glasswing-only niche model — same pricing tier as claude-fable-5."
    },
    "claude-mythos-5-1": {
      "inputPer1M": 10.0,
      "outputPer1M": 50.0,
      "cacheReadPer1M": 0.25,
      "cacheWritePer1M": 12.5,
      "cacheWrite1hPer1M": 20.0,
      "verifiedAt": "2026-10-05",
      "sourceUrl": "https://platform.claude.com/docs/en/about-claude/pricing",
      "notes": "Project Glasswing limited-availability model — same pricing tier as claude-fable-5-1, including the 0.025x cache-read multiplier."
    },
    "claude-opus-5-5": {
      "inputPer1M": 4.0,
      "outputPer1M": 20.0,
      "cacheReadPer1M": 0.2,
      "cacheWritePer1M": 5.0,
      "cacheWrite1hPer1M": 8.0,
      "verifiedAt": "2026-10-05",
      "sourceUrl": "https://platform.claude.com/docs/en/about-claude/pricing",
      "notes": "Cache reads priced at 0.05x base input (not the standard 0.1x multiplier) - Anthropic's documented rate, not an error. Do not 'correct' cacheReadPer1M toward inputPer1M * 0.1."
    },
    "claude-sonnet-5-5": {
      "inputPer1M": 2.0,
      "outputPer1M": 10.0,
      "cacheReadPer1M": 0.2,
      "cacheWritePer1M": 2.5,
      "cacheWrite1hPer1M": 4.0,
      "verifiedAt": "2026-10-05",
      "sourceUrl": "https://platform.claude.com/docs/en/about-claude/pricing"
    },
    "claude-haiku-5-5": {
      "inputPer1M": 0.1,
      "outputPer1M": 0.5,
      "cacheReadPer1M": 0.01,
      "cacheWritePer1M": 0.125,
      "cacheWrite1hPer1M": 0.2,
      "verifiedAt": "2026-10-23",
      "sourceUrl": "https://platform.claude.com/docs/en/about-claude/pricing",
      "notes": "Active; retirement not sooner than 2027-10-07. Tiered by prompt length: rates here are the <=100K-token tier. Prompts over 100K tokens (cache reads/writes count) bill at $0.50 in / $2.50 out / $0.05 cache read / $0.625 5m write / $1 1h write; the table has no tier support, so such requests are under-priced 5x."
    }
  },
  "openai": {
    "gpt-5.5": {
      "inputPer1M": 5.0,
      "outputPer1M": 30.0,
      "cacheReadPer1M": 0.5,
      "verifiedAt": "2026-10-05",
      "sourceUrl": "https://developers.openai.com/api/docs/pricing",
      "longContextThreshold": 272000,
      "longContextInputPer1M": 10.0,
      "longContextOutputPer1M": 45.0,
      "longContextCacheReadPer1M": 1.0,
      "notes": "Prompts over 272K input tokens bill at 2x input/cache and 1.5x output for the FULL request."
    },
    "gpt-5.5-pro": {
      "inputPer1M": 30.0,
      "outputPer1M": 180.0,
      "verifiedAt": "2026-10-05",
      "sourceUrl": "https://developers.openai.com/api/docs/pricing",
      "notes": "OpenAI's model page does not state a long-context surcharge for this model; none modeled (unverified whether one applies)."
    },
    "gpt-5.4": {
      "inputPer1M": 2.5,
      "outputPer1M": 15.0,
      "cacheReadPer1M": 0.25,
      "verifiedAt": "2026-10-05",
      "sourceUrl": "https://developers.openai.com/api/docs/pricing",
      "longContextThreshold": 272000,
      "longContextInputPer1M": 5.0,
      "longContextOutputPer1M": 22.5,
      "longContextCacheReadPer1M": 0.5,
      "notes": "Prompts over 272K input tokens bill at 2x input/cache and 1.5x output for the FULL request."
    },
    "gpt-5.4-mini": {
      "inputPer1M": 0.75,
      "outputPer1M": 4.5,
      "cacheReadPer1M": 0.075,
      "verifiedAt": "2026-10-05",
      "sourceUrl": "https://developers.openai.com/api/docs/pricing"
    },
    "gpt-4.1": {
      "inputPer1M": 2.0,
      "outputPer1M": 8.0,
      "cacheReadPer1M": 0.5,
      "verifiedAt": "2026-10-05",
      "sourceUrl": "https://developers.openai.com/api/docs/pricing",
      "notes": "Corrected 2026-10-04: the earlier 'scheduled shutdown 2026-10-23' claim was wrong. OpenAI's deprecations page lists only gpt-4.1-nano for that date; gpt-4.1 has no deprecation notice."
    },
    "gpt-4.1-mini": {
      "inputPer1M": 0.4,
      "outputPer1M": 1.6,